,text1,text2,aut_id1,aut_id2,same
101,"The fifties were a great time for the French thriller ; those years saw Decoin's "" La Verite Sur Bebe Donge "" , Allégret's "" Manèges "" , Salavsky's "" Les Louves "" , Delannoy's unfairly overlooked "" Obsession "" , and to top all of them HG Clouzot's IMDb top 250 "" Diaboliques "" . And Duvivier's masterful "" Voici le Temps Des Assassins "" Claude Boissol's effort in not in the same league , by a long shot . Whatever the director tried in his short-lived career , he failed : comedy ( the crude "" Julie La Rousse "" ) historical drama ( Napoleon II L'Aiglon probably his best though it does not mean much ) . According to historian Jean Tulard , his most interesting work is "" La Peau de l'Ours "" which featured an unexpected twist as far the murderer was concerned . With first-class thespians such as Daniele Delorme ( who had just made "" Voici Le Temps des Assassins "" her finest performance ) , Jean Marais , Françoise Fabian and Denise Gence , De La Comédie Française , how could a director be wrong ? It must be said in his defense that the screenplay is rather weak , some kind of a poor man's Boileau - Narcejac - who wrote "" Diaboliques "" and "" Vertigo "" - ; based on a Luisa Maria Linares novel which fluctuates between film noir ( life assurance , a dead who may not be dead , two wives , one of whom might slowly go nuts , exhumation ) and Harlequin Romance story ( the affair between Delorme and Marais ) . Most of the time the dialog does not ring true , it's even sometimes unintentionally funny , and the actors seem left to their own device . Even them cannot save the film from triteness .",". . . Old rivers grow wider every dayBut old people just grow lonesomeJohn Prine , "" Hello in there "" . My favorite MacCarey drama , better , IMHO , than his beloved works such as "" Going my way "" "" the bells of St Mary's "" "" An Affair to remember "" . Its influence was important in Europa , notably in France ( René Allio's "" La Vieille Dame Indigne "" ) or in Italy ( Luigi Comencini's "" Buon Natale , Buon anno ; Vittorio de Sica's "" Umberto D "" ) . Unforgettable scenes : The bridge game during which the old lady gets in the way . The sound of her rocking-chair , the phone call , the children ashamed of their mum , all rings true , all leaves a bitter taste in the mouth . The letter ma sent to pa : "" I cannot read anymore , you'll read the rest when your glasses are fixed "" the old man's buddy says as the news become more and more depressing . One should notice here McCarey's skills ; a tearjerker maker would have shown us through the home for aged people , but the sentences of the letter are much stronger than the pictures "" This is a lovely place "" the daughter-in-law keeps repeating . The last afternoon together , the last hours which are all the more precious . The tenderness the director feels for his characters is infinite . Victor Moore and Beulah Bondi shine during this extraordinary romantic final : coming back to the chic hotel where they spent their honeymoon , they won't return to their selfish children's home for one last meal ( what kind of beast could enjoy such a feast ? ) . In the hotel , they dance and there's that magic moment : the conductor , realizing these old people cannot adapt themselves to the new jazzy rhythms , asks his musicians to play "" let me call you sweetheart "" . The ending is one of the saddest I know . Whereas Frank Capra would have probably gathered the whole family in the station , or had Thomas Mitchell arrive at the last minute when the train moves off , McCarey refuses any happy end . Hence the failure of the movie when it was released . Make way for tomorrow indeed ! There are very revealing shots of New York with the skyscrapers and the cars which run faster and faster , leaving the old by the wayside . And however these sacred lines had warned us before the tragedy began : "" honor thy father and thy mother "" , written on an ominous sky . Waiting for someone to say Hello in there , Hello ( J . P . )",1219578,1219578,True
102,"I've never read the book of IT , but I did buy it for my mother's 30th birthday some years ago . She never took much interest so I had a browse myself . While not reading it cover to cover I did read about 100 pages in the middle section of the book just to see if it bore any resemblance to the TV-movie . Yes it does and no is doesn't . If that makes any sense . The characters are there and King's ever-recurring Derry is portrayed effectively enough as a dead-end , horrible town . But like most screen adaptations , it lacks the heavy substance of King's writing . But it would be hard to squeeze in over 1000 pages of story into a movie , even if it is 3 hours long . Split into two halves , the movie begins with the disappearance of a little girl , taken by an evil clown named Pennywise ( a deeply sinister Tim Curry ) . A local librarian recognizes the pattern of the murders and calls each of his friends ( The Lucky Seven / Losers Club ) who helped defeat Pennywise 30 years previously . Pennywise is not bound by the laws of physics and takes on the form of what each of the lucky seven are most afraid of . They find no other appropriate word to describe the phenomena other than IT . We see the backstory to each of them as they suddenly remember events they have mysteriously forgotten . A simple plot device , but effective . It makes the first half stronger than the second . From the 90-minute mark onwards we have a bunch of scared grown-ups who just seem to ask ' What are we going to do ? ' about a zillion times even though as kids they knew exactly what they were doing and were a lot tougher . The ultimate ending is a bit of a let down as it totally erases King's mythology and gives us some lame monster that is nothing compared to Pennywise himself . A helluva lot of King's mystery is simply torn out but IT still has enough energy and intrigue to make a decent stand-alone movie . But after 3 hours , I just wanted a better ending . Director Tommy Lee Wallace did want to shoot in Panavision ( an unusual move for a TV movie ) but the studio wouldn't allow him and so he compromised by shooting in flat 1 . 85 : 1 ( still irregular for 1990 ) . It would have been better to have a scope aspect ratio , especially with 7 characters sometimes occupying the screen at once . But you can blame studio interference for that . An above average TV movie , no doubt . Just loses momentum after the half-way mark and loses points for not sticking closer to King's book .","After being released from prison , Max ( Josh Holloway ) and his fiancée Roxanne ( Sarah Wayne Callies ) wish to have a fresh restart of their lives running a small dining of their own . However , the bank refuses to loan US$ 50 , 000 . 00 to them and without alternatives , Max accepts the invitation of his former partner Sydney ( Michael Rooker ) and his associate Vince ( Joel Edgerton ) to participate in the kidnapping of the eight year old David ( Blake Woodruff ) , the son of a wealthy woman in New England , under the command of a mysterious leader . The quartet drives with the boy to a camping area in Maine , closed in the cold winter , where they are individually disturbed by whispers that affects their behaviors until Max discloses the dark secret about David and his mother . "" Whisper "" is a very effective horror movie that scares without explicit violence or gore . The association of the fallen angel David and the Antichrist Damien from "" The Omen "" is quite immediate , but the creepy story is engaging and developed in a suitable pace . The young actor Blake Woodruff has a top-notch performance in the role of the evil soul collector and the acting and direction are solid . The twist with the identity of the leader of the kidnappers is a great unpredictable plot point . Title ( Brazil ) : "" Reféns do Mal "" ( "" Hostages of the Evil "" )",102816,2488512,False
103,"Any way you look at it , Bound is a sex thriller . The story is very engaging and the direction is absolutely incredible , but the whole lesbian thing really overshadows all of that , which severely limits the impact that this movie could have had . Gina Gershon stars as a tough woman who falls in love with Jennifer Tilly , who happens to be the girlfriend of a gangster ( Joe Pantoliano ) . The two concoct a scheme to steal $2 million from the mob , and this story is presented very skillfully and interestingly . Ironically enough , you have to look past all of the lesbian action between Tilly and Gershon in order to really experience the skill that this movie is full of . Bound is Larry and Andy Wachowskis ' writing and directing debut , proving that they had the skills from the start . The style that made The Matrix so good can be seen in nearly every shot in this film , and this style is probably the best part of the whole movie . But the excellent directing wasn't the only thing that made Bound so good . This is an great gangster film , despite a few cheesy or flawed moments . For example , it was a little weird that the mobsters who came to Pantoliano's apartment - suspicious of the murder that had recently taken place which Pantoliano was desperately trying to cover up - didn't see their own bloody footprints on the carpet , or at least feel the blood squishing up through the carpet as they walked on it . But that's okay , because where else can you see $2 million hung up in an apartment on dozens of wires , drying after having blood washed off of it ? This is good stuff . Gershon and Tilly work perfectly on screen , and not just in the sex scenes . Their unique relationship was made interesting by their skillful acting , which was best when they were beginning to distrust each other . Hey , that's what happens when you put your life into the hands of someone you just met . Gershon , in particular , delivered an excellent performance , flawlessly bringing out her masculine side to play the strong role in her relationship with Tilly . There is something to be said about a sex thriller that is as good and as engaging as Bound , because they never really are any good , you know ? Don't be put off by this element of the film , because Bound is a trashy movie that definitely deserves your attention .","In preparing to watch the latest installment of the Rambo series , I've gone back and re - watched all of the original three films , which I hadn't seen in probably 15 years . Unfortunately , they are so uniformly bad that it has taken me now over a year to get through the three of them . I finished watching part III today and , like the two films before it , it was a notably underwhelming cinematic experience . By this point in the series , the Rambo formula is worked out in every detail . Rambo just wants to be left alone but then gets sucked into some brutally violent situation which , again , he has to take care of all on his own . He doesn't really play well with others , you see . Just as we found him languishing in a prison labor camp at the beginning of the second movie , Rambo is now living the dubious life of a monk in Thailand who takes breaks from the monastery to head into Bangkok and make some extra money in the stick-fighting competitions , which he promptly turns over to the monks to help build the monastery . He likes the feeling of belonging that he gets from living among the monks and doesn't want to be a soldier anymore . Needless to say , when the guys with the stripes on their shoulders approach and ask for his help , he's uninterested until a mission goes forward in Afghanistan and results in the good guy from the second movie getting taken prisoner , the first American ever taken prisoner in Afghanistan . And here , just like the last movie , is where everything starts to fall apart . The first American ever captured in Afghanistan is not an enviable position , to be sure , so it's easy to understand why Rambo would make such a sudden change of heart . What is unfortunately missing is the entire rest of the American military . I'm curious about how the real members of the United States military responded to the movie , which portrays them as either helpless or completely absent . It may be , perhaps , that the mission is thought to be a lost cause or not worth the risk , so sending Rambo in must , of course , be done "" unofficially . "" If Rambo is caught , he is told prior to embarking on the mission , the military will deny all knowledge of his existence , which prompts Rambo to sneer and say he's used to such treatment , and then do that thing where he ties his headband on all dramatically . At any rate , it's no surprise when Rambo insists that he has to do everything on his own . If you saw the level of sheer camp that the second movie reached then you know something of what to expect here , although it should be said that Rambo III is certainly better than First Blood Part II , which is undeniably the worst film of the already unimpressive series . It is definitely interesting , however , to watch the way the Afghani people are portrayed in the movie . Rambo enters Afghanistan alone and has to make his way to where the prisoner is being kept with only a single in-country contact , who tells him all about the cultural realities on the ground for the Afghani people . Alexander the Great tried and failed to conquer the Afghans , then the British , then the Americans , and they all failed . He explains to Rambo and ancient battle prayer written by a long-since defeated enemy - "" May God deliver us from the venom of the cobra , the teeth of the tiger , and the vengeance of the Afghan . "" The relationship between America and Afghanistan has changed drastically over the years , and not in a good way . In fact , given that we're at war in Afghanistan right now , this movie appears strangely prophetic . If George W . Bush had re-watched Rambo III somewhere around early 2003 , it would not be a stretch to think that the situation in the middle east might be drastically different right now . "" Every day your war machines lose ground to a bunch of poorly armed , poorly equipped freedom fighters . The fact is you underestimated your competition . If you'd studied your history you would know that these people have never given up to anyone . They'd rather die than be slaves to an invading army . You can't defeat a people like that ! "" Believe it or not , this is not a scathing criticism of America's current war in Afghanistan , it's a scathing criticism by the American prisoner of the Soviet invasion of Afghanistan in the movie . It is one of the movie's strangest qualities that it pitts the Americans and the Afghans as allies against the cartoonishly villainous Soviets , who come in the form of wild-eyed lunatics at the controls of attack helicopters that buzz small villages laying waste unprovoked to whole populations of peaceful civilians . They are not just an invading force , they are airborne murderers that bombs women and children and disguise bombs as toys to trick unsuspecting children . With such enemies , it is understandable when one character ominously says , "" God would have mercy , Rambo won't . . . "" as Rambo sets off on his preposterous one-man mission of vengeance against the invading Soviets . It's interesting that the movie makes so much of how the Afghans have never given in to any invading force in their long history , and yet now they need Rambo to come in and save them from the Russians , but no matter . The movie was made to give the world another dose of outlandish Rambo-style retribution directed at the evil forces that be , and that's what it delivers . It's just too bad that Rambo-style retribution is generally so head-smackingly dumb .",562732,562732,True
104,"White Heat  may not be typical film noir in the literal sense , but the vibes are unmistakable . It's classic James Cagney noir , and he gives his best performance ever . It's the pinnacle for all future mobster movies - "" Godfather , "" "" Scarface "" ( the remake ) and even "" GoodFellas "" all borrow styles or concepts from this . The ending is eerily similar to Pacino in "" Scarface . "" Cagney stars as a mobster ( giving one of his snarling performances ) . The plot basically follows his rise and fall . Throughout , he has a strange fascination / obsession with his mother . He loves her more than his girlfriend . This is one element that really impressed me . For a film from 1949 it really handles some seedy elements rather well - this would still raise eyebrows if it were released over fifty years later ! Cagney is absolutely terrific . The film is a huge tour de force , breathtaking and mesmerizing . One of my favorite films , I would write more about the plot but I've found I always end up ruining the movie for people ! ( I have to restrain myself from referencing the ending ! ) If you like film noir , mobster movies or James Cagney ( or all of the above ! ) go buy this movie right now .","This is today's GV Surprise Screening . For their debut feature length film , directors Jonathan Dayton and Valerie Faris probably couldn't ask for a better script - Little Miss Sunshine is a comedic drama which has plenty of heart , even though the characters are misfits put together in a dysfunctional family . But wait , before you roll your eyes at yet another story with quirky characters , this one probably proved itself to be relatively superior given its easy going delivery , never taking itself too seriously with the messages it tried to put across , and the cast is a joy to behold . Telling the story of the Hoover family's journey cross-country to bring their young daughter to the finals of the Little Miss Sunshine beauty pageant , it's an insane road trip movie as well in their yellow family mini-van . Abigail Breslin first made her debut in M Night Shyamalan's Signs as Mel Gibson's daughter , and here she's the wide-eyed adorable child who will just tug at your heartstrings - you'll probably be sympathizing with her character's ( mis ) fortune with a family like hers . But there's where the fun is , no ? The more recognizable actors here will be Steve Carrell ( The 40 Year Old Virgin ) , as her gay scholarly uncle , and Toni Collette ( In Her Shoes ) as her mom . Rounding up the cast are Greg Kinnear as motivational-inspirational speaker Dad , Paul Dano as her brother who had taken a vow of silence , and Alan Arkin as coke-sniffing , foul - mouthed grandfather who dotes on her . While the opening might take its time to set the scene , once the family gets together there's no holding back . The dialogues and interactions between characters are fast and snappy , and each character's given enough screen time to showcase their tribulations and respective resolution . Which I found to be deftly done both in script and direction . There was one major loophole spotted , but nothing to mar your enjoyment of the movie . What I totally liked about the movie , is by the end of it , there's this warm fuzzy feeling that you'll feel about the message brought across , that the strength of family lies in sticking together , and through that , any adversary can be defeated , any troubles overcome . Anything else doesn't matter so long as there's unity , and the movie shows this pretty nicely - the gem of self-discovery together , and the getting out of the rut with support from one another . The crowd favourite is definitely the finale , which will more than likely to blow you away as it comes rather unexpectedly , and raises a few eyebrows too . At the screening , almost everyone was clapping and cheering , and the last time I experienced that kind of joy , was in the finale of Kinky Boots , which on hindsight , is similar in the kind of feeling it evokes from you . Though I must add that it was kind of unnerving somewhat watching the young performers prance around with their fake plastic smiles , stiff hair and loads of makeup . In life there are winners and there are losers . Little Miss Sunshine , is definitely a winner . Go watch !",1173088,317399,False
105,"THE CURSE OF THE OMEN is not without interest . It revolves around the supposed curse of Richard Donner's 1976 movie THE OMEN . Bad things happened before during and after the production . However many of the bad things that happened can surely be put down to coincidence and many of these terrible things have a tenuous connection with the movie For example we're told how stuntman Terry Walsh was standing in for Gregory Peck in the graveyard scene where the character Robert Thorn is attacked by a pack of rottweilers . Apparently they injured Walsh quite badly when they bit through his protective clothing . But as any stuntman will tell you the most dangerous stunts always revolve around animals because they have a mind of their own and their behaviour is impossible to predict . I should also point out that I'm a DOCTOR WHO fan and Walsh appeared in a great number of walk on parts in the BBC show and I've read several interviews on his career and seeing THE CURSE OF THE OMEN was the first time I'd heard about this incident . Perhaps the incident with the devil dogs has been exaggerated ? The documentary also mentioned another stuntman who worked on THE OMEN and was later seriously injured while filming A BRIDGE TOO FAR in Holland . Easily explained when you realise that stunt men do a dangerous job . I'm sure that everyone who worked on THE OMEN injured themselves some time or another The vagueness as to what this "" curse "" might be is also brought into question when Richard Donner explains the hotel he was staying in London was bombed by the IRA and that no matter what the weather was like he would always check under his car to make sure terrorists hadn't left a nasty surprise for him . This is common sense since the IRA were engaged in a sustained bombing campaign of London in 1974-75 , but it should be pointed out that if THE OMEN was filmed in 1973 or 1977 or had been filmed in another city the production team wouldn't have been subjected to terrorist bombings . Whose fault was it the hotel got bombed ? Is it the fault of a movie or the fault of a terrorist cell ? There is another incident that would have been laughably tenuous it if wasn't so tragic . Remember that scene in the movie where a character's head is sliced off by a truck with sheets of glass ? Well the effects artist behind that sequence John Richardson was driving in Holland when he was involved in a car crash and his travelling companion was "" cut almost in half and died instantly "" the insinuation being that it was like the scene from the film and most chilling of all it happened near to the town of Ommen ( sic ) ! Again it happened during the production of A BRIDGE TOO FAR . Perhaps that film is jinxed ? Strangely enough I was surprised that no one mentioned the decapitation scene was set in Megiddo in Israel a place that saw a bus bombing that murdered 17 people in June 2002 with heads and limbs scattered all over a road . Do you understand what I'm talking about when I mention shoehorning ? Coincidentally the word Armageddon is derived from the place name Megiddo . Again I'm surprised this wasn't mentioned To be fair Richard Donner himself dismisses these and other incidents as merely coincidence and categorically states that he doesn't believe in curses and regardless of whether they believe in curses or not fans of the film will find this interesting since it goes into depth about the anecdotes behind the making of the film including one about the famous scene with the goldfish . It's certainly a thought provoking documentary and would make a great companion piece to the movie","Ken Russell directed this weird ( Not very ) erotic thriller and if I hadn't known that I would have staked my life that the director was Brian DePalma . Absolutely everything about CRIMES OF PASSION screams DePalma , from the gaudy cinematography that is lit a little too brightly , to the domestic storyline that turns into a stalk and slash plot , to even the title this screams "" Depalma , DePalma , Depalma "" Unfortunately since Brian DePalma is increasingly seen as a poor mans Hitchcock over the years Russell should have tried emulating a style of his own . Sure an erotic thriller in the style of TOMMY or BILLION DOLLAR BRAIN would have been bizarre with a capital B but at least it would have been a unique cinematic experience . Stories about prostitutes living a dangerous double life and being stalked by a religious maniac were an all too common sight in the 1980s video market . Oh and Anthony Perkins plays the same role he played in almost every movie he made in the 1980s . Yawn The only thing of any real note to CRIMES OF PASSION is the controversy it caused . I guess the studio were the happiest people to hear this since no publicity is bad publicity , but as for the controversial sex scenes . . . What controversial sex scenes ? There aren't any and the only controversy I can think of is of China Blue dominating an on duty policeman with a truncheon . Needless to say he didn't come quietly HA HA HA HA HA HA HA H",1532177,1532177,True
