,text1,text2,aut_id1,aut_id2,same
48,"Atom Age Vampire  makes use of a lot of pseudo scientific jargon to make the most of "" restoring normal growth of abnormal cells "" and "" spontaneous reproduction of living cells "" . Professor Alberto Levin ( Alberto Lupo ) isn't sure of his Derma 28 invention , but able assistant Monique ( Franca Parisi ) convinces him to use the serum on the facially disfigured Jeanette Moreneau , a jilted lover whose out of control car dives over a cliff with the obligatory burst into flames aftermath . Roberto Bertea portrays the loyal lab assistant Sacha , whose presence doesn't do much to add or subtract from the film's proceedings . What's not explained very well is Levin's own mutation back and forth into a hideously disfigured wolfman with a complexion problem . The film's English title holds out possibilities , but it's more in the realm of suggestion than delivery ; not a vampire in the lot either , pseudo or otherwise . You can do worse than "" Atom Age Vampire "" , but then you'd be in "" Beast of Yucca Flats "" territory , hardly a worthwhile way to spend an hour . Unless you're like me and just have to sample every imaginable movie with a cool sounding title , you can let this one pass into modern age oblivion .","Is Sam evil ? The good guys warn of Sam's powers . Sam uses his power but for good . Dean has a mission . Will it involve Sam ? What is everything leading up to . The plot devices of the evil blond , Halloween and Sam's showdown with a very evil guy is in the mix . Not a bad episode but Supernatural's forth season is getting redundant . OK episode . Seven for this show . Love the Impelia the best plot device in the show . They should have a show just on the Impelia . I like the first season best . The second season was OK too . the 3rd season lacked for a while . Did not mind the 4th season so far . Howevery the producers seem to be running out of ideas .",2707735,453228,False
49,"i wasn't too impressed with this movie . it is in the style of both the Conan movies , but i didn't like it anywhere near as much . there was lots of action , but i still found it to be slow and boring . it becomes a bit more interesting from the halfway point on , but barely . i didn't find the acting very good , although Kevin Sorbo was good as the title character . but it was Tia Carrere who i thought was very impressive as the evil Queen . however , the only real reason i stuck it out was i noticed that the beginning credits listed Harvey Fierstein in the movie . he doesn't show up until about halfway through , but i liked him in his role . otherwise , the movie is tedious and very hard to get through . for me , Kull the Conqueror is a .","this is the firs movie in the Rambo series , and it's a good one . at least i think it is . it's a about a Vietnam veteran , and Green Beret ( Stallone ) who drifts into a sleepy town , for reasons of his own , minding his own business . but the local law , including the sheriff , ( Brian Dennehy ) , don't want his kind around . Rambo gets pushed to far , and decides to push back , unfortunately for the local law enforcement . if you haven't seen the movie , i won't give anything else away . this movie has a simple , straight forward story , that's fairly high on realism . it's not that far fetched that the events in the movie could happen . i believe Stallone should have at least been nominated for an academy award for his performance as Rambo , and Brian Denehhy should also have been nominated in a supporting category . both were very believable in their roles . also noteworthy is David Caruso in an early role . anyway , for me , First Blood is a",11423174,11423174,True
50,"This movie to me is more of a comedy than a horror . The scenes I remember most are the funny ones . Not to say it is a pure comedy , it isn't . It is though a very good vampire tale . The cast is superb , even Corey Haim and Feldman . This is definitely the best movie they did together . This one has a family of three ( a mother and two sons ) moving into her dad's home . They go around town and the younger one hears from some comic book workers that there are vampires in town . The older son is in fact being recruited by said vampires and is already becoming one after drinking a strange liquid . All in all I love this film and it is one of my favorite vampire flicks . Good mixture of action , horror , and especially for me . . . comedy . This movie is so very well made that you will find it hard to believe that the director of this would go on to make the pretty bad "" Batman and Robin "" . This movie though is good , and has one of the best ending lines of any movie .","There is a reason for the 4 . 2 IMDb rating . This film isn't very good . The cast is fine . Boris Karloff stars along with a decent supporting cast including Elisha Cook Jr . ( Wilmer from The Maltese Falcon ) . The story concerns a group of people that go to investigate the strange happenings on an island in the Pacific . Other than a few man-eating plants ( that could have easily been avoided ) nothing much happens . There is very little voodoo to speak of . And when the group meets the voodoo chief on this PACIFIC island , he's a white guy . But my main problem with the film is the script . The actors are given some of the stupidest things to say I've ever heard . Any given character is likely to say or do anything at any given moment regardless of the situation . I would only recommend this to a Karloff completist .",1111192,3109237,False
51,"1977 was apparently the year for neurotic romantic comedies featuring people who look like real people , if "" The Goodbye Girl "" and "" Annie Hall "" are anything to go by . Woody Allen's film is obviously the superior of the two , but I have a soft spot for Neil Simon's comedy , and I like it quite a lot . Richard Dreyfuss was on the cusp of stardom after his performance in "" Jaws , "" and his double score this year with "" The Goodbye Girl "" and "" Close Encounters of the Third Kind "" launched him into the big time . Marsha Mason was perfect at playing roles like this - - vulnerable softies looking for love while at the same time tough cookies who could make it on their own if forced to . In this film , the two meet cute when Dreyfuss shows up at Mason's apartment , having subletted it from Mason's boyfriend , who dumped her and took off without telling her that she and her ten-year-old daughter would be left with no place to live . Dreyfuss , a struggling actor , agrees to let the mom and daughter stay in the apartment with him , and of course after much bickering , the two fall in love . The movie is at its best when Dreyfuss and Mason are fighting . My favorite line is delivered by Mason after one of their many run-ins over Dreyfuss's bohemian living habits : "" I don't know you well enough to truly dislike you , but you are just too weird to live with . "" Quinn Cummings gives an adorable performance as Mason's daughter . She manages to be both precocious and cute ( think Tatum O'Neal in "" Paper Moon "" ) , a tough feat for a child actor . In one of the first scenes , while Mason is reading the dear john letter left by her louse of a boyfriend , who's left to star in a Bertolucci film , Cummings , instead of asking questions about what happened between her mom and boyfriend , or what they're going to do , or any other number of things it would make sense for a child to ask about , wants to know instead who Bertolucci is and what movies he's directed . A kid after my own heart .","This unnecessary sequel to the surprise 1984 hit picks up exactly where the previous film left off , and though it's not a great movie , it could have been much worse . In this one , Danny and Mr . Miyagi travel to Japan , where Danny finds himself in yet another karate showdown , and finds time to fall in love with a Japanese girl who's way hotter than Elisabeth Shue . Ralph Macchio and Pat Morita return to their roles , and have just as much chemistry together as they did before , even if the novelty has worn off a bit . Like many films from the 1980s , this one is most famous for its theme song , "" Glory of Love "" .",4532636,4532636,True
52,May contain spoilers . Trapped is a very movie . Kevin Bacon is once again a bad guy . Bacon can really play a bad character really well . In My opinion this character doesn't beat Kevin's Sebastian Caine but is it still a good bad none the less . Kevin Bacon is one of My favorite actors of all time ! I never really thought of anything of Charlize Theron to tell you the truth until this I saw this film . She was just a lot better in Trapped and I know she has a lot of talent . Courtney Love was excellent ! She looked so good and she is a promising actress ! She is very different with her unusual voice and great looks . Stuart Townsend was good and He I think is going places . Pruitt Taylor Vince was very good and Dakota Fanning was excellent for being a little girl she sure can act ! One scene that was great was when Bacon and Theron was in the bed room ! I really liked trapped because of the cast and the plot . The movie is put together really well with action and suspenseful / thrilling moments ! If you haven't seen trapped yet and love Kevin Bacon and the above mentioned cast then watch Trapped and while you watch it you'll be trapped ! Its that good !,"It doesn't take a ski accident to come up lame with this one . It is questionable SKI PARTY even has one leg to lean on . A cheap WHERE THE BOYS ARE ( 1960 ) . Boys wanting to meet girls ; snow bunnies looking for the "" right "" guy . If you can party on the beach ; why not a ski slope ? Terrible script overshadowed by the assembly of "" over acting "" . Frankie Avalon isn't even able to make this movie credible . Also in the cast are : Deborah Walley , Dwayne Hickman and Yvonne Craig . But there is something redeeming . . . singing appearances by Lesley Gore and James Brown .",1132073,449021,False
53,"Monsoon Wedding  splatters the screen with ebullience as a very westernized East Indian couple and throngs of family members in New Delhi convene for that universally most happy of occasions . A fun and festive flick with all manner of family issues expressed in and among the wedding preparations , this plotless film is a delightful hodgepodge of busy goings-on full of handsome folks in anxious anticipation the festivities . A delightful "" happening "" , "" Monsoon Wedding "" will score best with viewers into foreign films or with a specific interest in East Indian culture . (","Intermission  is a mediocre but well managed dark comedy which takes the slices of life of a bunch of Dubliners ( mostly bad people with bad attitudes ) and shuffles them like a deck of cards while keeping sufficient interconnectedness to hold the film together ala "" Magnolia "" . A high energy misanthro-pic built on a good cast in Dublin , "" Intermission "" has very little heart and an abundance of aholes which will make it a less than enjoyable watch for all but those who can appreciate annoyingly bellicose films such as ' Lock Stock . . . "" , "" Pulp Fiction "" , etc . Long on talent and short on story with only modest critical and public praise , "" Intermission "" is difficult to recommend . Personally I was bored numb by the film's end . ( B )",783721,783721,True
54,"You can tell that "" Bugs Bunny and the Three Bears "" was a pretty early Looney Tunes cartoon , but it has held up well through the years . It has the Three Bears trying to attract Goldilocks with carrot soup , but attracting Bugs Bunny instead . You can probably guess what sorts of things happen from there . A particularly interesting character here was Junyer Bear . Despite being the youngest cast member , he's the tallest ( almost twice as tall as Papa Bear , to be precise ) . Oh well , this is a cartoon , so there's no reason to obsess on something like that . You're supposed to just sit back and enjoy yourself . And enjoy yourself you will watching this cartoon . Doing the voices of the Looney Tunes for all those years , Mel Blanc was truly a man among men . And although Bea Benaderet wasn't credited ( she voices Mama Bear ) , her role in this and similar cartoons leads me to believe that she must have been a woman among women .","Enjoyed this great Hallmark Theatre Presentation which had a very down to earth dramatic event which happens in people's lives and two women who both experience horrible events in their lives . One is a married woman with teenage boys and a great husband who loves her and they have a young one year old baby girl who has a babysitter who is distracted by her brothers and the baby falls to her death down a flight of stairs . This woman is named Lorainne Morrisey , ( Jennifer Ehle ) and the babysitter is Sarah Russell , ( Amber Tamblyn ) . This tragic event occurred six years ago and time has passed by and Sarah Russell is a buyer for Macy's Department Store in Chicago and is also informed that she has been accepted in Northwestern University in Chicago to pursue a medical profession . Unfortunately , Sarah is also informed by medical doctors that she has an aggressive leukemia which must be treated immediately . This is a great story about a mother who lost her baby daughter and blames a babysitter for this tragedy and the babysitter feeling that she caused this babies death . Don't miss this TV film the next time it is shown .",4888011,663392,False
55,"This disappointing giallo does offer some atmospheric sequences and lots of nudity , but the story progresses in a very fragmented fashion , making it hard for the viewer to even tell the characters apart , and the gore effects are embarrassing , actually some of the worst I've ever seen in an Italian horror film . As for the identity of the killer , I have to admit the movie fooled me into a wrong guess . However , that doesn't say much ; considering "" Torso "" ' s obvious disregard for credible motivation , the killer could have been just about anyone . ( )","A well-observed , well-made drama ( with occasional comedic moments ) , that may not be exactly "" high art "" ( it's neither profound nor original ) , but DOES feature some great acting and manages to pull you in . Debra Winger gives an extraordinary performance ; she has a naturalness and expressiveness that you rarely see on the screen . When her character is happy , her whole face brightens up and her joy becomes infectious ; when she's sad or confused or embarrassed , the emotions come across strongly , although she never goes over the top . Considering that she lost the Oscar to her co-star , Shirley MacLaine , who is reasonably good but far more one-note , I'd say we had a major Academy Award injustice there . Jack Nicholson is fun to watch and has some amusing lines , and most supporting roles , like those played by John Lithgow and Danny De Vito , are also first-rate and completely believable . So overall it's a good film , directed almost flawlessly , although in the final 20 minutes it needlessly wallows in melodrama . ( )",386241,386241,True
56,"This special about The Great One is hosted by Jeff Garlin of "" Curb Your Enthusiasm "" . He basically just stands there and mentions many things about what makes Jackie Gleason what he was . His widow , Marilyn Taylor Gleason , is also interviewed about her late husband's work habits-such as his refusal to rehearse more than once-and about his characters that he showcased on "" The Jackie Gleason Show "" during the ' 50s . Among his characters that we see clips of : The Poor Soul , Fenwick Babbitt , Joe the Bartender , Rudy the Repairman , Charlie Bratton the Loudmouth , Reginald Van Gleason III , and , of course , Ralph Kramden . Of course , many of those clips also have second banana Art Carney in them especially the Kramden ones where he plays the scene-stealing Ed Norton . There's also an Audrey Meadows one in which she doesn't play Alice Kramden : a Reginald Van Gleason where she plays his girlfriend Monica who wants to marry him . Reginald responds by literally sending her to the moon ! Many other funny sketches abound though both Rudy and Charlie may be a little too obnoxious for my tastes . While I do love "" The Honeymooners "" , the scenes picked for this special seem to emphasize the arguments of Ralph and Alice too much and not enough on the great chemistry of Ed and Ralph and , by extension , Art and Jackie . I did love the "" Can You Do This ? "" game show sketch that Fenwick enters and many of the Gleason dances especially one where he danced with Marilyn . I also loved The Poor Soul sketch where he fails at bowling and the various Joe the Bartender monologues . And I admit liking one story Charlie told Clem ( Carney ) about his uncle , a garbage man . This special only showcased Gleason's work on his ' 50s TV variety show . Maybe someday someone with make a DVD box set of whatever surviving episodes from that era exists .","I know a little about "" Sweeny Todd "" , but I haven't seen any other films / TV Shows or read any books based on the legend , which makes this my first experience with it ; and I'm highly disappointed . The disappointment grows further because this story and Tim Burton's directorial style are clearly a match made in heaven - but for some reason , a terrible decision was made on how the film would work and it's spoilt something that could have been great . I would write a song about this film's main problem - but I'd prefer to clearly state that it's the musical elements that spoil it . The plot is rich with horrific elements and should be a great base for a gory Gothic horror film . We focus on Benjamin Barker ; better known as Sweeny Todd , a barber returning to London for revenge against all those that have wronged him . Upon his return to the capital , he meets Mrs . Lovett , the owner of a pie shop where "" The Worst Pies in London "" are made . If I made the worst pies in London , I'd keep my mouth shut about it - but she sings songs instead and unsurprisingly her shop isn't doing very well . Anyway , Sweeny Todd opens up a barbers shop upstairs and his lust for killing soon combines with her need for meat to put in pies . I have to say that the film looks great . Tim Burton has his own directorial style and it translates to the screen very well here and aesthetically , every scene is a joy to behold . The good points continue with the cast ; Johnny Depp is always a pleasure to watch and he clearly relishes this role , while Mrs Tim Burton ; Helena Bonham Carter , does well starring opposite and the director has also done a good job recruiting some good British talent to fill the supporting roles . The film is also rather graphic and Burton provides the viewers with some real nasty sights including a spate of throat slashing that result in blood spraying everywhere , a succession of corpses falling through a trapdoor and hitting the ground with a brutal thud as well as a machine that grinds Sweeny Todd's victims into pie meat . This is all well and good but it all comes down to the execution , and the musical elements really spoil it . Many reviewers have said that the horror and musical elements bode well in this film ; but for me it really doesn't work . It comes off as being almost cringe-worthy in places and constantly forced me to ask myself WHY they made this a musical ( I know there was a musical version of this story , but there's also several none musical versions ) . Another problem with the music is that it all sounds very similar and the songs are not very diverse . The first hour or so is really rather boring anyway and the constant singing soon starts to grate . Things improve massively towards the end and despite a couple of songs ; the final half hour is really quite good . Overall , I love the atmosphere and the gore of this film - but I can't get on with the musical elements at all , which unfortunately means that a film which could have been a masterpiece is sadly not much better than passable . A shame .",11228318,2248099,False
57,"OK , I admit it : I rented this movie only because it has Eva Grimaldi in it ; well , Eva has only a minor , virtually non-speaking part , and the film is far from the conventional erotic thriller you might expect based on the video box promotion . It's really not a very good movie , but it's unlike anything you've ever seen before . Part kinky soft-core sex film , part murder mystery , set in a vaguely futuristic world , it is a very strange , very arty film , with some bizarre music ( "" The Man I Love "" ! ) and casting ( female bodybuilder Teagan as . . . herself ) choices . It's obvious that one of the goals of this movie was to create ( with limited means ) its own world ; it succeeded admirably . By the way , did the person who said that "" it wants to be like "" Basic Instinct "" "" bother to check out its production date ? ( )","City on Fire  was made in 1979 , when the disaster genre was already past its prime - and a dispirited , tired affair it is . Most of the actors ( except for the amusingly unbalanced villain ) sleepwalk through their roles , possibly knowing that the film had no chance of reviving the genre . At least there are some pretty realistic effects , though the movie never makes clear how exactly the fire spread over the entire city . ( )",386241,386241,True
58,"An alien from outer space bites a bio-researcher and turns him into hideous monster with an urge to kill . Its first victim is the guardian at the hospital he's working in . The guardians ' daughters are getting worried that their father haven't called them and they go to the hospital , where they meet their worst nightmare . "" Metamorphosis : The Alien Factor "" is a wonderfully cheesy trash loaded with gore and gross monster effects . It certainly better than "" Dark Universe "" , "" Alien Predator "" or "" The Star Crystal "" . The plot is silly and full of holes , but the monster creations and stop-motion visuals are of a quality well beyond what one usually finds in movies on this level and remain convincing and scary throughout . Check it out .","I viewed the Turner-Time / Warner print of this movie . ' The Fire Brigade ' is a firefighting drama which also manages to be a piece of propaganda for firefighters . . . as if these brave souls needed any spin control . There are several firemen characters in this film , and without exception all of them are depicted as brave , resourceful and selfless . No pyromaniacs or cowards , as in the later ' Backdraft ' . The fire-fighting sequences are exciting and well-staged , often making the actors seem to be in genuine danger . . . and the film-makers are clearly pleased to show these fictional firemen using the very latest ( genuine ) fire-fighting equipment , vintage 1926 . I fear , though , that modern viewers would laugh at much of this equipment , which of course is primitive by modern standards . Also , this movie's soap-opera subplot considerably dilutes the excitement . Charles Ray plays the latest in an Irish-American family of firemen . He's engaged to marry Helen Corwin ( May McAvoy ) , the daughter of a wealthy building contractor . Unfortunately , her dad ( Holmes Herbert ) is a crook : he has knowingly committed safety violations in several of his buildings ; this increases his profit but it also means the buildings are firetraps . You can see where this is heading . The final scene is exciting , with Ray trapped on a burning rooftop with a golden-haired little girl . Tom O'Brien is excellent as Ray's older brother , who is a member of the same fire brigade . DeWitt Jennings , an underrated actor , is splendid as the fire chief whose job is made more difficult by conniving politicians . ' The Fire Brigade ' saddens me because of the fate of its leading players . The very beautiful blond May McAvoy and the handsome Charles Ray were both stars in silent films , but they plunged into obscurity very quickly when talking pictures arrived . May McAvoy was the leading lady in the early part-talking film ' The Jazz Singer ' , although she had no lines on the soundtrack of that movie . But soon she had to face the microphone : her talkie roles revealed that she had a lisp and an indecisive manner , and the sound revolution proved she wasn't much of an actress . The tragic course of her career is summed up perfectly by two of her credits : in the 1925 silent classic ' Ben-Hur ' , May McAvoy was the leading lady . . . and in the 1959 remake of ' Ben-Hur ' , May McAvoy was a faceless extra in the crowd scenes . Charles Ray's career followed a less spectacular version of the same arc . He was a star in silent films , usually playing good-hearted country boys . His voice proved unsuitable for talking films , and soon enough he was working as a dress extra , wearing a tuxedo in nightclub scenes . That's show biz , I suppose . I'll rate ' The Fire Brigade ' .",865972,1609079,False
